SELECT setting::integer < 100000 AS pre_10,
       setting::integer < 120000 AS pre_12
FROM pg_settings WHERE name = 'server_version_num';
 pre_10 | pre_12 
--------+--------
 f      | t
(1 row)

/*
 * Create a sequence to test non-serial primary keys.  This actually tests
 * things like uuid primary keys, but makes for reproducible test cases.
 */
CREATE SEQUENCE pricing_seq;
CREATE TABLE pricing (id1 bigserial,
                      id2 bigint PRIMARY KEY DEFAULT nextval('pricing_seq'),
                      id3 bigint GENERATED ALWAYS AS IDENTITY,
                      id4 bigint GENERATED ALWAYS AS (id1 + id2) STORED,
                      product text, min_quantity integer, max_quantity integer, price numeric);
ERROR:  syntax error at or near "("
LINE 4: ...                   id4 bigint GENERATED ALWAYS AS (id1 + id2...
                                                             ^
CREATE TABLE pricing (id1 bigserial,
                      id2 bigint PRIMARY KEY DEFAULT nextval('pricing_seq'),
                      id3 bigint GENERATED ALWAYS AS IDENTITY,
                      product text, min_quantity integer, max_quantity integer, price numeric);
CREATE TABLE pricing (id1 bigserial,
                      id2 bigint PRIMARY KEY DEFAULT nextval('pricing_seq'),
                      product text, min_quantity integer, max_quantity integer, price numeric);
ERROR:  relation "pricing" already exists
SELECT periods.add_period('pricing', 'quantities', 'min_quantity', 'max_quantity');
 add_period 
------------
 t
(1 row)

SELECT periods.add_for_portion_view('pricing', 'quantities');
 add_for_portion_view 
----------------------
 t
(1 row)

TABLE periods.for_portion_views;
 table_name | period_name |             view_name              |       trigger_name        
------------+-------------+------------------------------------+---------------------------
 pricing    | quantities  | pricing__for_portion_of_quantities | for_portion_of_quantities
(1 row)

/* Test UPDATE FOR PORTION */
INSERT INTO pricing (product, min_quantity, max_quantity, price) VALUES ('Trinket', 1, 20, 200);
TABLE pricing ORDER BY min_quantity;
 id1 | id2 | id3 | product | min_quantity | max_quantity | price 
-----+-----+-----+---------+--------------+--------------+-------
   1 |   1 |   1 | Trinket |            1 |           20 |   200
(1 row)

-- UPDATE fully preceding
UPDATE pricing__for_portion_of_quantities SET min_quantity = 0, max_quantity = 1, price = 0;
TABLE pricing ORDER BY min_quantity;
 id1 | id2 | id3 | product | min_quantity | max_quantity | price 
-----+-----+-----+---------+--------------+--------------+-------
   1 |   1 |   1 | Trinket |            1 |           20 |   200
(1 row)

-- UPDATE fully succeeding
UPDATE pricing__for_portion_of_quantities SET min_quantity = 30, max_quantity = 50, price = 0;
TABLE pricing ORDER BY min_quantity;
 id1 | id2 | id3 | product | min_quantity | max_quantity | price 
-----+-----+-----+---------+--------------+--------------+-------
   1 |   1 |   1 | Trinket |            1 |           20 |   200
(1 row)

-- UPDATE fully surrounding
UPDATE pricing__for_portion_of_quantities SET min_quantity = 0, max_quantity = 100, price = 100;
TABLE pricing ORDER BY min_quantity;
 id1 | id2 | id3 | product | min_quantity | max_quantity | price 
-----+-----+-----+---------+--------------+--------------+-------
   1 |   1 |   1 | Trinket |            1 |           20 |   100
(1 row)

-- UPDATE portion
UPDATE pricing__for_portion_of_quantities SET min_quantity = 10, max_quantity = 20, price = 80;
TABLE pricing ORDER BY min_quantity;
 id1 | id2 | id3 | product | min_quantity | max_quantity | price 
-----+-----+-----+---------+--------------+--------------+-------
   2 |   2 |   2 | Trinket |            1 |           10 |   100
   1 |   1 |   1 | Trinket |           10 |           20 |    80
(2 rows)

-- UPDATE portion of multiple rows
UPDATE pricing__for_portion_of_quantities SET min_quantity = 5, max_quantity = 15, price = 90;
TABLE pricing ORDER BY min_quantity;
 id1 | id2 | id3 | product | min_quantity | max_quantity | price 
-----+-----+-----+---------+--------------+--------------+-------
   3 |   3 |   3 | Trinket |            1 |            5 |   100
   2 |   2 |   2 | Trinket |            5 |           10 |    90
   1 |   1 |   1 | Trinket |           10 |           15 |    90
   4 |   4 |   4 | Trinket |           15 |           20 |    80
(4 rows)

-- If we drop the period (without CASCADE) then the FOR PORTION views should be
-- dropped, too.
SELECT periods.drop_period('pricing', 'quantities');
 drop_period 
-------------
 t
(1 row)

TABLE periods.for_portion_views;
 table_name | period_name | view_name | trigger_name 
------------+-------------+-----------+--------------
(0 rows)

-- Add it back to test the drop_for_portion_view function
SELECT periods.add_period('pricing', 'quantities', 'min_quantity', 'max_quantity');
 add_period 
------------
 t
(1 row)

SELECT periods.add_for_portion_view('pricing', 'quantities');
 add_for_portion_view 
----------------------
 t
(1 row)

-- We can't drop the the table without first dropping the FOR PORTION views
-- because Postgres will complain about dependant objects (our views) before we
-- get a chance to clean them up.
DROP TABLE pricing;
ERROR:  cannot drop table pricing because other objects depend on it
DETAIL:  view pricing__for_portion_of_quantities depends on table pricing
HINT:  Use DROP ... CASCADE to drop the dependent objects too.
SELECT periods.drop_for_portion_view('pricing', NULL);
 drop_for_portion_view 
-----------------------
 t
(1 row)

TABLE periods.for_portion_views;
 table_name | period_name | view_name | trigger_name 
------------+-------------+-----------+--------------
(0 rows)

DROP TABLE pricing;
DROP SEQUENCE pricing_seq;
/* Make sure we handle nulls correctly */
CREATE TABLE portions (col1 text, col2 text, col3 text, s integer, e integer);
SELECT periods.add_period('portions', 'p', 's', 'e');
 add_period 
------------
 t
(1 row)

SELECT periods.add_for_portion_view('portions', 'p');
 add_for_portion_view 
----------------------
 t
(1 row)

INSERT INTO portions VALUES
    ('a', 'b', 'c', 100, 200),
    ('a', null, 'c', 100, 200),
    (null, null, 'c', 100, 200);
TABLE portions ORDER BY col1, col2, s, e;
 col1 | col2 | col3 |  s  |  e  
------+------+------+-----+-----
 a    | b    | c    | 100 | 200
 a    |      | c    | 100 | 200
      |      | c    | 100 | 200
(3 rows)

UPDATE portions__for_portion_of_p SET s = 125, e = 175;
TABLE portions ORDER BY col1, col2, s, e;
 col1 | col2 | col3 |  s  |  e  
------+------+------+-----+-----
 a    | b    | c    | 100 | 200
 a    |      | c    | 100 | 200
      |      | c    | 100 | 200
(3 rows)

UPDATE portions__for_portion_of_p SET col3 = 'd', s = 125, e = 175;
TABLE portions ORDER BY col1, col2, s, e;
 col1 | col2 | col3 |  s  |  e  
------+------+------+-----+-----
 a    | b    | c    | 100 | 125
 a    | b    | d    | 125 | 175
 a    | b    | c    | 175 | 200
 a    |      | c    | 100 | 125
 a    |      | d    | 125 | 175
 a    |      | c    | 175 | 200
      |      | c    | 100 | 125
      |      | d    | 125 | 175
      |      | c    | 175 | 200
(9 rows)

SELECT periods.drop_for_portion_view('portions', NULL);
 drop_for_portion_view 
-----------------------
 t
(1 row)

DROP TABLE portions;
