SELECT setting::integer < 90600 AS pre_96,
       setting::integer < 100000 AS pre_10,
       setting::integer < 120000 AS pre_12
FROM pg_settings WHERE name = 'server_version_num';
 pre_96 | pre_10 | pre_12 
--------+--------+--------
 f      | t      | t
(1 row)

/* Install the extension */
CREATE EXTENSION IF NOT EXISTS btree_gist;
CREATE EXTENSION periods;
/*
 * Test creating a table, dropping a column, and then dropping the whole thing;
 * without any periods.
 */
CREATE TABLE beeswax (col1 text, col2 date);
ALTER TABLE beeswax DROP COLUMN col1;
DROP TABLE beeswax;
/* Basic period definitions with dates */
CREATE TABLE basic (val text, s date, e date);
TABLE periods.periods;
 table_name | period_name | start_column_name | end_column_name | range_type | bounds_check_constraint 
------------+-------------+-------------------+-----------------+------------+-------------------------
(0 rows)

SELECT periods.add_period('basic', 'bp', 's', 'e');
 add_period 
------------
 t
(1 row)

TABLE periods.periods;
 table_name | period_name | start_column_name | end_column_name | range_type | bounds_check_constraint 
------------+-------------+-------------------+-----------------+------------+-------------------------
 basic      | bp          | s                 | e               | daterange  | basic_bp_check
(1 row)

SELECT periods.drop_period('basic', 'bp');
 drop_period 
-------------
 t
(1 row)

TABLE periods.periods;
 table_name | period_name | start_column_name | end_column_name | range_type | bounds_check_constraint 
------------+-------------+-------------------+-----------------+------------+-------------------------
(0 rows)

SELECT periods.add_period('basic', 'bp', 's', 'e');
 add_period 
------------
 t
(1 row)

TABLE periods.periods;
 table_name | period_name | start_column_name | end_column_name | range_type | bounds_check_constraint 
------------+-------------+-------------------+-----------------+------------+-------------------------
 basic      | bp          | s                 | e               | daterange  | basic_bp_check
(1 row)

/* Test constraints */
INSERT INTO basic (val, s, e) VALUES ('x', null, null); --fail
ERROR:  null value in column "s" violates not-null constraint
DETAIL:  Failing row contains (x, null, null).
INSERT INTO basic (val, s, e) VALUES ('x', '3000-01-01', null); --fail
ERROR:  null value in column "e" violates not-null constraint
DETAIL:  Failing row contains (x, 01-01-3000, null).
INSERT INTO basic (val, s, e) VALUES ('x', null, '1000-01-01'); --fail
ERROR:  null value in column "s" violates not-null constraint
DETAIL:  Failing row contains (x, null, 01-01-1000).
INSERT INTO basic (val, s, e) VALUES ('x', '3000-01-01', '1000-01-01'); --fail
ERROR:  new row for relation "basic" violates check constraint "basic_bp_check"
DETAIL:  Failing row contains (x, 01-01-3000, 01-01-1000).
INSERT INTO basic (val, s, e) VALUES ('x', '1000-01-01', '3000-01-01'); --success
TABLE basic;
 val |     s      |     e      
-----+------------+------------
 x   | 01-01-1000 | 01-01-3000
(1 row)

/* Test dropping the whole thing */
DROP TABLE basic;
TABLE periods.periods;
 table_name | period_name | start_column_name | end_column_name | range_type | bounds_check_constraint 
------------+-------------+-------------------+-----------------+------------+-------------------------
(0 rows)

/* Unique and Foreign Keys */
-- Unique keys are already pretty much guaranteed by the underlying features of
-- PostgreSQL, but test them anyway.
CREATE TABLE uk (id integer, s integer, e integer, CONSTRAINT uk_pkey PRIMARY KEY (id, s, e));
SELECT periods.add_period('uk', 'p', 's', 'e');
 add_period 
------------
 t
(1 row)

SELECT periods.add_unique_key('uk', ARRAY['id'], 'p', key_name => 'uk_id_p', unique_constraint => 'uk_pkey');
 add_unique_key 
----------------
 t
(1 row)

INSERT INTO uk (id, s, e) VALUES (100, 1, 3), (100, 3, 4), (100, 4, 10); -- success
INSERT INTO uk (id, s, e) VALUES (200, 1, 3), (200, 3, 4), (200, 5, 10); -- success
INSERT INTO uk (id, s, e) VALUES (300, 1, 3), (300, 3, 5), (300, 4, 10); -- fail
ERROR:  conflicting key value violates exclusion constraint "uk_id_int4range_excl"
DETAIL:  Key (id, int4range(s, e, '[)'::text))=(300, [4,10)) conflicts with existing key (id, int4range(s, e, '[)'::text))=(300, [3,5)).
CREATE TABLE fk (id integer, uk_id integer, s integer, e integer, PRIMARY KEY (id));
SELECT periods.add_period('fk', 'q', 's', 'e');
 add_period 
------------
 t
(1 row)

SELECT periods.add_foreign_key('fk', ARRAY['uk_id'], 'q', 'uk_id_p', key_name => 'fk_uk_id_q');
 add_foreign_key 
-----------------
 fk_uk_id_q
(1 row)

-- INSERT
INSERT INTO fk VALUES (0, 100, 0, 1); -- fail
ERROR:  insert or update on table "fk" violates foreign key constraint "fk_uk_id_q"
CONTEXT:  PL/pgSQL function periods.validate_foreign_key_new_row(name,jsonb) line 134 at RAISE
SQL statement "SELECT periods.validate_foreign_key_new_row(TG_ARGV[0], jnew)"
PL/pgSQL function periods.fk_insert_check() line 20 at PERFORM
INSERT INTO fk VALUES (0, 100, 0, 10); -- fail
ERROR:  insert or update on table "fk" violates foreign key constraint "fk_uk_id_q"
CONTEXT:  PL/pgSQL function periods.validate_foreign_key_new_row(name,jsonb) line 134 at RAISE
SQL statement "SELECT periods.validate_foreign_key_new_row(TG_ARGV[0], jnew)"
PL/pgSQL function periods.fk_insert_check() line 20 at PERFORM
INSERT INTO fk VALUES (0, 100, 1, 11); -- fail
ERROR:  insert or update on table "fk" violates foreign key constraint "fk_uk_id_q"
CONTEXT:  PL/pgSQL function periods.validate_foreign_key_new_row(name,jsonb) line 134 at RAISE
SQL statement "SELECT periods.validate_foreign_key_new_row(TG_ARGV[0], jnew)"
PL/pgSQL function periods.fk_insert_check() line 20 at PERFORM
INSERT INTO fk VALUES (1, 100, 1, 3); -- success
INSERT INTO fk VALUES (2, 100, 1, 10); -- success
-- UPDATE
UPDATE fk SET e = 20 WHERE id = 1; -- fail
ERROR:  insert or update on table "fk" violates foreign key constraint "fk_uk_id_q"
CONTEXT:  PL/pgSQL function periods.validate_foreign_key_new_row(name,jsonb) line 134 at RAISE
SQL statement "SELECT periods.validate_foreign_key_new_row(TG_ARGV[0], jnew)"
PL/pgSQL function periods.fk_update_check() line 19 at PERFORM
UPDATE fk SET e = 6 WHERE id = 1; -- success
UPDATE uk SET s = 2 WHERE (id, s, e) = (100, 1, 3); -- fail
ERROR:  update or delete on table "uk" violates foreign key constraint "fk_uk_id_q" on table "fk"
CONTEXT:  PL/pgSQL function periods.validate_foreign_key_old_row(name,jsonb,boolean) line 103 at RAISE
SQL statement "SELECT periods.validate_foreign_key_old_row(TG_ARGV[0], jold, true)"
PL/pgSQL function periods.uk_update_check() line 23 at PERFORM
UPDATE uk SET s = 0 WHERE (id, s, e) = (100, 1, 3); -- success
-- DELETE
DELETE FROM uk WHERE (id, s, e) = (100, 3, 4); -- fail
ERROR:  update or delete on table "uk" violates foreign key constraint "fk_uk_id_q" on table "fk"
CONTEXT:  PL/pgSQL function periods.validate_foreign_key_old_row(name,jsonb,boolean) line 103 at RAISE
SQL statement "SELECT periods.validate_foreign_key_old_row(TG_ARGV[0], jold, false)"
PL/pgSQL function periods.uk_delete_check() line 22 at PERFORM
DELETE FROM uk WHERE (id, s, e) = (200, 3, 5); -- success
DROP TABLE fk;
DROP TABLE uk;
/* FOR PORTION tests */
CREATE TABLE pricing (id1 bigserial,
                      id2 bigint GENERATED ALWAYS AS IDENTITY,
                      id3 bigint GENERATED ALWAYS AS (id1 + id2) STORED,
                      product text, min_quantity integer, max_quantity integer, price numeric);
ERROR:  syntax error at or near "GENERATED"
LINE 3:                       id2 bigint GENERATED ALWAYS AS IDENTIT...
                                         ^
CREATE TABLE pricing (id1 bigserial,
                      id2 bigint GENERATED ALWAYS AS IDENTITY,
                      product text, min_quantity integer, max_quantity integer, price numeric);
ERROR:  syntax error at or near "GENERATED"
LINE 2:                       id2 bigint GENERATED ALWAYS AS IDENTIT...
                                         ^
CREATE TABLE pricing (id1 bigserial,
                      product text, min_quantity integer, max_quantity integer, price numeric);
SELECT periods.add_period('pricing', 'quantities', 'min_quantity', 'max_quantity');
 add_period 
------------
 t
(1 row)

SELECT periods.add_for_portion_view('pricing', 'quantities');
 add_for_portion_view 
----------------------
 t
(1 row)

TABLE periods.for_portion_views;
 table_name | period_name |             view_name              |       trigger_name        
------------+-------------+------------------------------------+---------------------------
 pricing    | quantities  | pricing__for_portion_of_quantities | for_portion_of_quantities
(1 row)

/* Test UPDATE FOR PORTION */
INSERT INTO pricing (product, min_quantity, max_quantity, price) VALUES ('Trinket', 1, 20, 200);
TABLE pricing ORDER BY min_quantity;
 id1 | product | min_quantity | max_quantity | price 
-----+---------+--------------+--------------+-------
   1 | Trinket |            1 |           20 |   200
(1 row)

-- UPDATE fully preceding
UPDATE pricing__for_portion_of_quantities SET min_quantity = 0, max_quantity = 1, price = 0;
TABLE pricing ORDER BY min_quantity;
 id1 | product | min_quantity | max_quantity | price 
-----+---------+--------------+--------------+-------
   1 | Trinket |            1 |           20 |   200
(1 row)

-- UPDATE fully succeeding
UPDATE pricing__for_portion_of_quantities SET min_quantity = 30, max_quantity = 50, price = 0;
TABLE pricing ORDER BY min_quantity;
 id1 | product | min_quantity | max_quantity | price 
-----+---------+--------------+--------------+-------
   1 | Trinket |            1 |           20 |   200
(1 row)

-- UPDATE fully surrounding
UPDATE pricing__for_portion_of_quantities SET min_quantity = 0, max_quantity = 100, price = 100;
TABLE pricing ORDER BY min_quantity;
 id1 | product | min_quantity | max_quantity | price 
-----+---------+--------------+--------------+-------
   1 | Trinket |            1 |           20 |   100
(1 row)

-- UPDATE portion
UPDATE pricing__for_portion_of_quantities SET min_quantity = 10, max_quantity = 20, price = 80;
TABLE pricing ORDER BY min_quantity;
 id1 | product | min_quantity | max_quantity | price 
-----+---------+--------------+--------------+-------
   2 | Trinket |            1 |           10 |   100
   1 | Trinket |           10 |           20 |    80
(2 rows)

-- UPDATE portion of multiple rows
UPDATE pricing__for_portion_of_quantities SET min_quantity = 5, max_quantity = 15, price = 90;
TABLE pricing ORDER BY min_quantity;
 id1 | product | min_quantity | max_quantity | price 
-----+---------+--------------+--------------+-------
   3 | Trinket |            1 |            5 |   100
   2 | Trinket |            5 |           10 |    90
   1 | Trinket |           10 |           15 |    90
   4 | Trinket |           15 |           20 |    80
(4 rows)

-- If we drop the period (without CASCADE) then the FOR PORTION views should be
-- dropped, too.
SELECT periods.drop_period('pricing', 'quantities');
 drop_period 
-------------
 t
(1 row)

TABLE periods.for_portion_views;
 table_name | period_name | view_name | trigger_name 
------------+-------------+-----------+--------------
(0 rows)

-- Add it back to test the drop_for_portion_view function
SELECT periods.add_period('pricing', 'quantities', 'min_quantity', 'max_quantity');
 add_period 
------------
 t
(1 row)

SELECT periods.add_for_portion_view('pricing', 'quantities');
 add_for_portion_view 
----------------------
 t
(1 row)

-- We can't drop the the table without first dropping the FOR PORTION views
-- because Postgres will complain about dependant objects (our views) before we
-- get a chance to clean them up.
DROP TABLE pricing;
ERROR:  cannot drop table pricing because other objects depend on it
DETAIL:  view pricing__for_portion_of_quantities depends on table pricing
HINT:  Use DROP ... CASCADE to drop the dependent objects too.
SELECT periods.drop_for_portion_view('pricing', NULL);
 drop_for_portion_view 
-----------------------
 t
(1 row)

TABLE periods.for_portion_views;
 table_name | period_name | view_name | trigger_name 
------------+-------------+-----------+--------------
(0 rows)

DROP TABLE pricing;
/* SYSTEM_TIME with date */
BEGIN;
SELECT transaction_timestamp()::date AS xd,
       transaction_timestamp()::timestamp AS xts,
       transaction_timestamp() AS xtstz
\gset
CREATE TABLE sysver_date (val text, start_date date, end_date date);
SELECT periods.add_system_time_period('sysver_date', 'start_date', 'end_date');
 add_system_time_period 
------------------------
 t
(1 row)

TABLE periods.periods;
 table_name  | period_name | start_column_name | end_column_name | range_type |    bounds_check_constraint    
-------------+-------------+-------------------+-----------------+------------+-------------------------------
 sysver_date | system_time | start_date        | end_date        | daterange  | sysver_date_system_time_check
(1 row)

INSERT INTO sysver_date DEFAULT VALUES;
SELECT val, start_date = :'xd' AS start_date_eq, end_date FROM sysver_date;
 val | start_date_eq | end_date 
-----+---------------+----------
     | t             | infinity
(1 row)

DROP TABLE sysver_date;
/* SYSTEM_TIME with timestamp without time zone */
CREATE TABLE sysver_ts (val text, start_ts timestamp without time zone, end_ts timestamp without time zone);
SELECT periods.add_system_time_period('sysver_ts', 'start_ts', 'end_ts');
 add_system_time_period 
------------------------
 t
(1 row)

TABLE periods.periods;
 table_name | period_name | start_column_name | end_column_name | range_type |   bounds_check_constraint   
------------+-------------+-------------------+-----------------+------------+-----------------------------
 sysver_ts  | system_time | start_ts          | end_ts          | tsrange    | sysver_ts_system_time_check
(1 row)

INSERT INTO sysver_ts DEFAULT VALUES;
SELECT val, start_ts = :'xts' AS start_ts_eq, end_ts FROM sysver_ts;
 val | start_ts_eq |  end_ts  
-----+-------------+----------
     | t           | infinity
(1 row)

DROP TABLE sysver_ts;
/* SYSTEM_TIME with timestamp with time zone */
CREATE TABLE sysver_tstz (val text, start_tstz timestamp with time zone, end_tstz timestamp with time zone);
SELECT periods.add_system_time_period('sysver_tstz', 'start_tstz', 'end_tstz');
 add_system_time_period 
------------------------
 t
(1 row)

TABLE periods.periods;
 table_name  | period_name | start_column_name | end_column_name | range_type |    bounds_check_constraint    
-------------+-------------+-------------------+-----------------+------------+-------------------------------
 sysver_tstz | system_time | start_tstz        | end_tstz        | tstzrange  | sysver_tstz_system_time_check
(1 row)

INSERT INTO sysver_tstz DEFAULT VALUES;
SELECT val, start_tstz = :'xtstz' AS start_tstz_eq, end_tstz FROM sysver_tstz;
 val | start_tstz_eq | end_tstz 
-----+---------------+----------
     | t             | infinity
(1 row)

DROP TABLE sysver_tstz;
COMMIT;
/* Basic SYSTEM_TIME periods with CASCADE/purge */
CREATE TABLE sysver (val text);
SELECT periods.add_system_time_period('sysver', 'startname');
 add_system_time_period 
------------------------
 t
(1 row)

SELECT periods.drop_period('sysver', 'system_time', drop_behavior => 'CASCADE', purge => true);
 drop_period 
-------------
 t
(1 row)

SELECT periods.add_system_time_period('sysver', end_column_name => 'endname');
 add_system_time_period 
------------------------
 t
(1 row)

SELECT periods.drop_period('sysver', 'system_time', drop_behavior => 'CASCADE', purge => true);
 drop_period 
-------------
 t
(1 row)

SELECT periods.add_system_time_period('sysver', 'startname', 'endname');
 add_system_time_period 
------------------------
 t
(1 row)

SELECT periods.drop_system_time_period('sysver', drop_behavior => 'CASCADE', purge => true);
 drop_system_time_period 
-------------------------
 t
(1 row)

SELECT periods.add_system_time_period('sysver', 'endname', 'startname');
 add_system_time_period 
------------------------
 t
(1 row)

SELECT periods.drop_system_time_period('sysver', drop_behavior => 'CASCADE', purge => true);
 drop_system_time_period 
-------------------------
 t
(1 row)

SELECT periods.add_system_time_period('sysver');
 add_system_time_period 
------------------------
 t
(1 row)

DROP TABLE sysver;
TABLE periods.periods;
 table_name | period_name | start_column_name | end_column_name | range_type | bounds_check_constraint 
------------+-------------+-------------------+-----------------+------------+-------------------------
(0 rows)

TABLE periods.system_time_periods;
 table_name | period_name | infinity_check_constraint | generated_always_trigger | write_history_trigger | truncate_trigger 
------------+-------------+---------------------------+--------------------------+-----------------------+------------------
(0 rows)

/* Basic SYSTEM VERSIONING */
CREATE TABLE sysver (val text);
SELECT periods.add_system_time_period('sysver');
 add_system_time_period 
------------------------
 t
(1 row)

TABLE periods.system_time_periods;
 table_name | period_name |       infinity_check_constraint       |      generated_always_trigger       |      write_history_trigger       | truncate_trigger 
------------+-------------+---------------------------------------+-------------------------------------+----------------------------------+------------------
 sysver     | system_time | sysver_system_time_end_infinity_check | sysver_system_time_generated_always | sysver_system_time_write_history | sysver_truncate
(1 row)

TABLE periods.system_versioning;
 table_name | period_name | history_table_name | view_name | func_as_of | func_between | func_between_symmetric | func_from_to 
------------+-------------+--------------------+-----------+------------+--------------+------------------------+--------------
(0 rows)

SELECT periods.add_system_versioning('sysver');
NOTICE:  history table "sysver_history" created for "sysver", be sure to index it properly
 add_system_versioning 
-----------------------
 
(1 row)

TABLE periods.system_versioning;
 table_name | period_name | history_table_name |      view_name      |               func_as_of                |                            func_between                            |                            func_between_symmetric                            |                            func_from_to                            
------------+-------------+--------------------+---------------------+-----------------------------------------+--------------------------------------------------------------------+------------------------------------------------------------------------------+--------------------------------------------------------------------
 sysver     | system_time | sysver_history     | sysver_with_history | sysver__as_of(timestamp with time zone) | sysver__between(timestamp with time zone,timestamp with time zone) | sysver__between_symmetric(timestamp with time zone,timestamp with time zone) | sysver__from_to(timestamp with time zone,timestamp with time zone)
(1 row)

INSERT INTO sysver (val) VALUES ('hello');
SELECT val FROM sysver;
  val  
-------
 hello
(1 row)

SELECT val FROM sysver_history ORDER BY system_time_start;
 val 
-----
(0 rows)

SELECT transaction_timestamp() AS ts1 \gset
UPDATE sysver SET val = 'world';
SELECT val FROM sysver;
  val  
-------
 world
(1 row)

SELECT val FROM sysver_history ORDER BY system_time_start;
  val  
-------
 hello
(1 row)

SELECT transaction_timestamp() AS ts2 \gset
DELETE FROM sysver;
SELECT val FROM sysver;
 val 
-----
(0 rows)

SELECT val FROM sysver_history ORDER BY system_time_start;
  val  
-------
 hello
 world
(2 rows)

/* temporal queries */
SELECT val FROM sysver__as_of(:'ts1') ORDER BY system_time_start;
  val  
-------
 hello
(1 row)

SELECT val FROM sysver__as_of(:'ts2') ORDER BY system_time_start;
  val  
-------
 world
(1 row)

SELECT val FROM sysver__from_to(:'ts1', :'ts2') ORDER BY system_time_start;
  val  
-------
 hello
 world
(2 rows)

SELECT val FROM sysver__from_to(:'ts2', :'ts1') ORDER BY system_time_start;
 val 
-----
(0 rows)

SELECT val FROM sysver__between(:'ts1', :'ts2') ORDER BY system_time_start;
  val  
-------
 hello
 world
(2 rows)

SELECT val FROM sysver__between(:'ts2', :'ts1') ORDER BY system_time_start;
 val 
-----
(0 rows)

SELECT val FROM sysver__between_symmetric(:'ts1', :'ts2') ORDER BY system_time_start;
  val  
-------
 hello
 world
(2 rows)

SELECT val FROM sysver__between_symmetric(:'ts2', :'ts1') ORDER BY system_time_start;
  val  
-------
 hello
 world
(2 rows)

/* TRUNCATE should delete the history, too */
SELECT val FROM sysver_with_history;
  val  
-------
 hello
 world
(2 rows)

TRUNCATE sysver;
SELECT val FROM sysver_with_history; --empty
 val 
-----
(0 rows)

/* Try modifying several times in a transaction */
BEGIN;
INSERT INTO sysver (val) VALUES ('hello');
INSERT INTO sysver (val) VALUES ('world');
ROLLBACK;
SELECT val FROM sysver_with_history; --empty
 val 
-----
(0 rows)

BEGIN;
INSERT INTO sysver (val) VALUES ('hello');
UPDATE sysver SET val = 'world';
UPDATE sysver SET val = 'world2';
UPDATE sysver SET val = 'world3';
DELETE FROM sysver;
COMMIT;
SELECT val FROM sysver_with_history; --empty
 val 
-----
(0 rows)

-- We can't drop the the table without first dropping SYSTEM VERSIONING because
-- Postgres will complain about dependant objects (our view functions) before
-- we get a chance to clean them up.
DROP TABLE sysver;
ERROR:  cannot drop table sysver because other objects depend on it
DETAIL:  view sysver_with_history depends on table sysver
function sysver__as_of(timestamp with time zone) depends on type sysver_with_history
function sysver__between(timestamp with time zone,timestamp with time zone) depends on type sysver_with_history
function sysver__between_symmetric(timestamp with time zone,timestamp with time zone) depends on type sysver_with_history
function sysver__from_to(timestamp with time zone,timestamp with time zone) depends on type sysver_with_history
HINT:  Use DROP ... CASCADE to drop the dependent objects too.
SELECT periods.drop_system_versioning('sysver', drop_behavior => 'CASCADE', purge => true);
 drop_system_versioning 
------------------------
 t
(1 row)

TABLE periods.system_versioning;
 table_name | period_name | history_table_name | view_name | func_as_of | func_between | func_between_symmetric | func_from_to 
------------+-------------+--------------------+-----------+------------+--------------+------------------------+--------------
(0 rows)

DROP TABLE sysver;
TABLE periods.periods;
 table_name | period_name | start_column_name | end_column_name | range_type | bounds_check_constraint 
------------+-------------+-------------------+-----------------+------------+-------------------------
(0 rows)

TABLE periods.system_time_periods;
 table_name | period_name | infinity_check_constraint | generated_always_trigger | write_history_trigger | truncate_trigger 
------------+-------------+---------------------------+--------------------------+-----------------------+------------------
(0 rows)

/* Clean up */
DROP EXTENSION periods;
